{
    "$schema": "https://raw.githubusercontent.com/Milly/runtray-ps/v1.1.0/schema.json",
    "name": "ping-local",
    "description": "Pinging localhost continuously.",
    "executable": "%WinDir%\\System32\\ping.exe",
    "arguments": ["-t", "127.0.0.1"],
    "workingdirectory": "%USERPROFILE%",
    "shutdownwait": 2000
}
